{
  "title": "Número Anterior e Próximo (1–5)",
  "level": "7A",
  "example": "Escreva o número anterior ou o próximo.",
  "subject": "math",
  "repeatAll": 2,
  "passCriteria": { "minAccuracyPercent": 80, "maxAvgSecondsPerExercise": 6 },
  "pages": [
    {
      "pageNumber": 1,
      "title": "Próximo número",
      "description": "Escreva o próximo número.",
      "exercises": [
        {
          "type": "next_number",
          "question": "Depois de 1 vem:",
          "correctAnswer": 2
        },
        {
          "type": "next_number",
          "question": "Depois de 2 vem:",
          "correctAnswer": 3
        },
        {
          "type": "next_number",
          "question": "Depois de 3 vem:",
          "correctAnswer": 4
        },
        {
          "type": "next_number",
          "question": "Depois de 4 vem:",
          "correctAnswer": 5
        },
        {
          "type": "next_number",
          "question": "Depois de 0 vem:",
          "correctAnswer": 1
        },
        {
          "type": "next_number",
          "question": "Depois de 1 vem:",
          "correctAnswer": 2
        },
        {
          "type": "next_number",
          "question": "Depois de 2 vem:",
          "correctAnswer": 3
        },
        {
          "type": "next_number",
          "question": "Depois de 3 vem:",
          "correctAnswer": 4
        },
        {
          "type": "next_number",
          "question": "Depois de 4 vem:",
          "correctAnswer": 5
        },
        {
          "type": "next_number",
          "question": "Depois de 0 vem:",
          "correctAnswer": 1
        }
      ]
    },
    {
      "pageNumber": 2,
      "title": "Número anterior",
      "description": "Escreva o número anterior.",
      "exercises": [
        {
          "type": "previous_number",
          "question": "Antes de 2 vem:",
          "correctAnswer": 1
        },
        {
          "type": "previous_number",
          "question": "Antes de 3 vem:",
          "correctAnswer": 2
        },
        {
          "type": "previous_number",
          "question": "Antes de 4 vem:",
          "correctAnswer": 3
        },
        {
          "type": "previous_number",
          "question": "Antes de 5 vem:",
          "correctAnswer": 4
        },
        {
          "type": "previous_number",
          "question": "Antes de 1 vem:",
          "correctAnswer": 0
        },
        {
          "type": "previous_number",
          "question": "Antes de 2 vem:",
          "correctAnswer": 1
        },
        {
          "type": "previous_number",
          "question": "Antes de 3 vem:",
          "correctAnswer": 2
        },
        {
          "type": "previous_number",
          "question": "Antes de 4 vem:",
          "correctAnswer": 3
        },
        {
          "type": "previous_number",
          "question": "Antes de 5 vem:",
          "correctAnswer": 4
        },
        {
          "type": "previous_number",
          "question": "Antes de 1 vem:",
          "correctAnswer": 0
        }
      ]
    }
  ],
  "target": 40
}
