{
  "title": "Adição Simples (até 10)",
  "level": "4A",
  "example": "Some e escreva o resultado.",
  "subject": "math",
  "passCriteria": { "minAccuracyPercent": 90, "maxAvgSecondsPerExercise": 4.5 },
  "repeatAll": 3,
  "pages": [
    {
      "pageNumber": 1,
      "title": "Adição básica 1",
      "description": "Resolva as somas.",
      "exercises": [
        {
          "type": "addition",
          "question": "1 + 1 =",
          "correctAnswer": 2
        },
        {
          "type": "addition",
          "question": "2 + 1 =",
          "correctAnswer": 3
        },
        {
          "type": "addition",
          "question": "2 + 2 =",
          "correctAnswer": 4
        },
        {
          "type": "addition",
          "question": "3 + 1 =",
          "correctAnswer": 4
        },
        {
          "type": "addition",
          "question": "3 + 2 =",
          "correctAnswer": 5
        },
        {
          "type": "addition",
          "question": "4 + 1 =",
          "correctAnswer": 5
        },
        {
          "type": "addition",
          "question": "4 + 2 =",
          "correctAnswer": 6
        },
        {
          "type": "addition",
          "question": "5 + 2 =",
          "correctAnswer": 7
        },
        {
          "type": "addition",
          "question": "6 + 1 =",
          "correctAnswer": 7
        },
        {
          "type": "addition",
          "question": "7 + 2 =",
          "correctAnswer": 9
        }
      ]
    },
    {
      "pageNumber": 2,
      "title": "Adição básica 2",
      "description": "Resolva as somas.",
      "exercises": [
        {
          "type": "addition",
          "question": "1 + 3 =",
          "correctAnswer": 4
        },
        {
          "type": "addition",
          "question": "2 + 3 =",
          "correctAnswer": 5
        },
        {
          "type": "addition",
          "question": "3 + 3 =",
          "correctAnswer": 6
        },
        {
          "type": "addition",
          "question": "4 + 3 =",
          "correctAnswer": 7
        },
        {
          "type": "addition",
          "question": "5 + 3 =",
          "correctAnswer": 8
        },
        {
          "type": "addition",
          "question": "6 + 3 =",
          "correctAnswer": 9
        },
        {
          "type": "addition",
          "question": "1 + 4 =",
          "correctAnswer": 5
        },
        {
          "type": "addition",
          "question": "2 + 4 =",
          "correctAnswer": 6
        },
        {
          "type": "addition",
          "question": "3 + 4 =",
          "correctAnswer": 7
        },
        {
          "type": "addition",
          "question": "4 + 4 =",
          "correctAnswer": 8
        }
      ]
    }
  ],
  "target": 60
}
