{
  "title": "Contar Objetos 1–20",
  "level": "5A",
  "example": "Conte os objetos e escreva o número.",
  "subject": "math",
  "repeatAll": 3,
  "passCriteria": { "minAccuracyPercent": 90, "maxAvgSecondsPerExercise": 5 },
  "pages": [
    {
      "pageNumber": 1,
      "title": "Contar 1–10",
      "description": "Conte os símbolos.",
      "exercises": [
        {
          "type": "count",
          "question": "★",
          "correctAnswer": 1
        },
        {
          "type": "count",
          "question": "● ●",
          "correctAnswer": 2
        },
        {
          "type": "count",
          "question": "▲ ▲ ▲",
          "correctAnswer": 3
        },
        {
          "type": "count",
          "question": "◆ ◆ ◆ ◆",
          "correctAnswer": 4
        },
        {
          "type": "count",
          "question": "♥ ♥ ♥ ♥ ♥",
          "correctAnswer": 5
        },
        {
          "type": "count",
          "question": "☀ ☀ ☀ ☀ ☀ ☀",
          "correctAnswer": 6
        },
        {
          "type": "count",
          "question": "♣ ♣ ♣ ♣ ♣ ♣ ♣",
          "correctAnswer": 7
        },
        {
          "type": "count",
          "question": "★ ★ ★ ★ ★ ★ ★ ★",
          "correctAnswer": 8
        },
        {
          "type": "count",
          "question": "● ● ● ● ● ● ● ● ●",
          "correctAnswer": 9
        },
        {
          "type": "count",
          "question": "▲ ▲ ▲ ▲ ▲ ▲ ▲ ▲ ▲ ▲",
          "correctAnswer": 10
        }
      ]
    },
    {
      "pageNumber": 2,
      "title": "Contar 11–20",
      "description": "Conte os símbolos.",
      "exercises": [
        {
          "type": "count",
          "question": "★ ★ ★ ★ ★ ★ ★ ★ ★ ★ ★",
          "correctAnswer": 11
        },
        {
          "type": "count",
          "question": "● ● ● ● ● ● ● ● ● ● ● ●",
          "correctAnswer": 12
        },
        {
          "type": "count",
          "question": "▲ ▲ ▲ ▲ ▲ ▲ ▲ ▲ ▲ ▲ ▲ ▲ ▲",
          "correctAnswer": 13
        },
        {
          "type": "count",
          "question": "◆ ◆ ◆ ◆ ◆ ◆ ◆ ◆ ◆ ◆ ◆ ◆ ◆ ◆",
          "correctAnswer": 14
        },
        {
          "type": "count",
          "question": "♥ ♥ ♥ ♥ ♥ ♥ ♥ ♥ ♥ ♥ ♥ ♥ ♥ ♥ ♥",
          "correctAnswer": 15
        },
        {
          "type": "count",
          "question": "☀ ☀ ☀ ☀ ☀ ☀ ☀ ☀ ☀ ☀ ☀ ☀ ☀ ☀ ☀ ☀",
          "correctAnswer": 16
        },
        {
          "type": "count",
          "question": "♣ ♣ ♣ ♣ ♣ ♣ ♣ ♣ ♣ ♣ ♣ ♣ ♣ ♣ ♣ ♣ ♣",
          "correctAnswer": 17
        },
        {
          "type": "count",
          "question": "★ ★ ★ ★ ★ ★ ★ ★ ★ ★ ★ ★ ★ ★ ★ ★ ★ ★",
          "correctAnswer": 18
        },
        {
          "type": "count",
          "question": "● ● ● ● ● ● ● ● ● ● ● ● ● ● ● ● ● ● ●",
          "correctAnswer": 19
        },
        {
          "type": "count",
          "question": "▲ ▲ ▲ ▲ ▲ ▲ ▲ ▲ ▲ ▲ ▲ ▲ ▲ ▲ ▲ ▲ ▲ ▲ ▲ ▲",
          "correctAnswer": 20
        }
      ]
    }
  ],
  "target": 60
}
