{
  "title": "Contar Objetos 1–50",
  "level": "4A",
  "example": "Conte os objetos e escreva o número.",
  "subject": "math",
  "passCriteria": { "minAccuracyPercent": 90, "maxAvgSecondsPerExercise": 4.5 },
  "pages": [
    {
      "pageNumber": 1,
      "title": "Contar 1–10",
      "description": "Conte os símbolos.",
      "exercises": [
        {
          "type": "count",
          "question": "●",
          "correctAnswer": 1
        },
        {
          "type": "count",
          "question": "● ●",
          "correctAnswer": 2
        },
        {
          "type": "count",
          "question": "● ● ●",
          "correctAnswer": 3
        },
        {
          "type": "count",
          "question": "● ● ● ●",
          "correctAnswer": 4
        },
        {
          "type": "count",
          "question": "● ● ● ● ●",
          "correctAnswer": 5
        },
        {
          "type": "count",
          "question": "● ● ● ● ● ●",
          "correctAnswer": 6
        },
        {
          "type": "count",
          "question": "● ● ● ● ● ● ●",
          "correctAnswer": 7
        },
        {
          "type": "count",
          "question": "● ● ● ● ● ● ● ●",
          "correctAnswer": 8
        },
        {
          "type": "count",
          "question": "● ● ● ● ● ● ● ● ●",
          "correctAnswer": 9
        },
        {
          "type": "count",
          "question": "● ● ● ● ● ● ● ● ● ●",
          "correctAnswer": 10
        }
      ]
    },
    {
      "pageNumber": 2,
      "title": "Contar 11–20",
      "description": "Conte os símbolos.",
      "exercises": [
        {
          "type": "count",
          "question": "● ● ● ● ● ● ● ● ● ● ●",
          "correctAnswer": 11
        },
        {
          "type": "count",
          "question": "● ● ● ● ● ● ● ● ● ● ● ●",
          "correctAnswer": 12
        },
        {
          "type": "count",
          "question": "● ● ● ● ● ● ● ● ● ● ● ● ●",
          "correctAnswer": 13
        },
        {
          "type": "count",
          "question": "● ● ● ● ● ● ● ● ● ● ● ● ● ●",
          "correctAnswer": 14
        },
        {
          "type": "count",
          "question": "● ● ● ● ● ● ● ● ● ● ● ● ● ● ●",
          "correctAnswer": 15
        },
        {
          "type": "count",
          "question": "● ● ● ● ● ● ● ● ● ● ● ● ● ● ● ●",
          "correctAnswer": 16
        },
        {
          "type": "count",
          "question": "● ● ● ● ● ● ● ● ● ● ● ● ● ● ● ● ●",
          "correctAnswer": 17
        },
        {
          "type": "count",
          "question": "● ● ● ● ● ● ● ● ● ● ● ● ● ● ● ● ● ●",
          "correctAnswer": 18
        },
        {
          "type": "count",
          "question": "● ● ● ● ● ● ● ● ● ● ● ● ● ● ● ● ● ● ●",
          "correctAnswer": 19
        },
        {
          "type": "count",
          "question": "● ● ● ● ● ● ● ● ● ● ● ● ● ● ● ● ● ● ● ●",
          "correctAnswer": 20
        }
      ]
    },
    {
      "pageNumber": 3,
      "title": "Contar 21–30",
      "description": "Conte os símbolos.",
      "exercises": [
        {
          "type": "count",
          "question": "● ● ● ● ● ● ● ● ● ● ● ● ● ● ● ● ● ● ● ● ●",
          "correctAnswer": 21
        },
        {
          "type": "count",
          "question": "● ● ● ● ● ● ● ● ● ● ● ● ● ● ● ● ● ● ● ● ● ●",
          "correctAnswer": 22
        },
        {
          "type": "count",
          "question": "● ● ● ● ● ● ● ● ● ● ● ● ● ● ● ● ● ● ● ● ● ● ●",
          "correctAnswer": 23
        },
        {
          "type": "count",
          "question": "● ● ● ● ● ● ● ● ● ● ● ● ● ● ● ● ● ● ● ● ● ● ● ●",
          "correctAnswer": 24
        },
        {
          "type": "count",
          "question": "● ● ● ● ● ● ● ● ● ● ● ● ● ● ● ● ● ● ● ● ● ● ● ● ●",
          "correctAnswer": 25
        },
        {
          "type": "count",
          "question": "● ● ● ● ● ● ● ● ● ● ● ● ● ● ● ● ● ● ● ● ● ● ● ● ● ●",
          "correctAnswer": 26
        },
        {
          "type": "count",
          "question": "● ● ● ● ● ● ● ● ● ● ● ● ● ● ● ● ● ● ● ● ● ● ● ● ● ● ●",
          "correctAnswer": 27
        },
        {
          "type": "count",
          "question": "● ● ● ● ● ● ● ● ● ● ● ● ● ● ● ● ● ● ● ● ● ● ● ● ● ● ● ●",
          "correctAnswer": 28
        },
        {
          "type": "count",
          "question": "● ● ● ● ● ● ● ● ● ● ● ● ● ● ● ● ● ● ● ● ● ● ● ● ● ● ● ● ●",
          "correctAnswer": 29
        },
        {
          "type": "count",
          "question": "● ● ● ● ● ● ● ● ● ● ● ● ● ● ● ● ● ● ● ● ● ● ● ● ● ● ● ● ● ●",
          "correctAnswer": 30
        }
      ]
    },
    {
      "pageNumber": 4,
      "title": "Contar 31–40",
      "description": "Conte os símbolos.",
      "exercises": [
        {
          "type": "count",
          "question": "● ● ● ● ● ● ● ● ● ● ● ● ● ● ● ● ● ● ● ● ● ● ● ● ● ● ● ● ● ● ●",
          "correctAnswer": 31
        },
        {
          "type": "count",
          "question": "● ● ● ● ● ● ● ● ● ● ● ● ● ● ● ● ● ● ● ● ● ● ● ● ● ● ● ● ● ● ● ●",
          "correctAnswer": 32
        },
        {
          "type": "count",
          "question": "● ● ● ● ● ● ● ● ● ● ● ● ● ● ● ● ● ● ● ● ● ● ● ● ● ● ● ● ● ● ● ● ●",
          "correctAnswer": 33
        },
        {
          "type": "count",
          "question": "● ● ● ● ● ● ● ● ● ● ● ● ● ● ● ● ● ● ● ● ● ● ● ● ● ● ● ● ● ● ● ● ● ●",
          "correctAnswer": 34
        },
        {
          "type": "count",
          "question": "● ● ● ● ● ● ● ● ● ● ● ● ● ● ● ● ● ● ● ● ● ● ● ● ● ● ● ● ● ● ● ● ● ● ●",
          "correctAnswer": 35
        },
        {
          "type": "count",
          "question": "● ● ● ● ● ● ● ● ● ● ● ● ● ● ● ● ● ● ● ● ● ● ● ● ● ● ● ● ● ● ● ● ● ● ● ●",
          "correctAnswer": 36
        },
        {
          "type": "count",
          "question": "● ● ● ● ● ● ● ● ● ● ● ● ● ● ● ● ● ● ● ● ● ● ● ● ● ● ● ● ● ● ● ● ● ● ● ● ●",
          "correctAnswer": 37
        },
        {
          "type": "count",
          "question": "● ● ● ● ● ● ● ● ● ● ● ● ● ● ● ● ● ● ● ● ● ● ● ● ● ● ● ● ● ● ● ● ● ● ● ● ● ●",
          "correctAnswer": 38
        },
        {
          "type": "count",
          "question": "● ● ● ● ● ● ● ● ● ● ● ● ● ● ● ● ● ● ● ● ● ● ● ● ● ● ● ● ● ● ● ● ● ● ● ● ● ● ●",
          "correctAnswer": 39
        },
        {
          "type": "count",
          "question": "● ● ● ● ● ● ● ● ● ● ● ● ● ● ● ● ● ● ● ● ● ● ● ● ● ● ● ● ● ● ● ● ● ● ● ● ● ● ● ●",
          "correctAnswer": 40
        }
      ]
    },
    {
      "pageNumber": 5,
      "title": "Contar 41–50",
      "description": "Conte os símbolos.",
      "exercises": [
        {
          "type": "count",
          "question": "● ● ● ● ● ● ● ● ● ● ● ● ● ● ● ● ● ● ● ● ● ● ● ● ● ● ● ● ● ● ● ● ● ● ● ● ● ● ● ● ●",
          "correctAnswer": 41
        },
        {
          "type": "count",
          "question": "● ● ● ● ● ● ● ● ● ● ● ● ● ● ● ● ● ● ● ● ● ● ● ● ● ● ● ● ● ● ● ● ● ● ● ● ● ● ● ● ● ●",
          "correctAnswer": 42
        },
        {
          "type": "count",
          "question": "● ● ● ● ● ● ● ● ● ● ● ● ● ● ● ● ● ● ● ● ● ● ● ● ● ● ● ● ● ● ● ● ● ● ● ● ● ● ● ● ● ● ●",
          "correctAnswer": 43
        },
        {
          "type": "count",
          "question": "● ● ● ● ● ● ● ● ● ● ● ● ● ● ● ● ● ● ● ● ● ● ● ● ● ● ● ● ● ● ● ● ● ● ● ● ● ● ● ● ● ● ● ●",
          "correctAnswer": 44
        },
        {
          "type": "count",
          "question": "● ● ● ● ● ● ● ● ● ● ● ● ● ● ● ● ● ● ● ● ● ● ● ● ● ● ● ● ● ● ● ● ● ● ● ● ● ● ● ● ● ● ● ● ●",
          "correctAnswer": 45
        },
        {
          "type": "count",
          "question": "● ● ● ● ● ● ● ● ● ● ● ● ● ● ● ● ● ● ● ● ● ● ● ● ● ● ● ● ● ● ● ● ● ● ● ● ● ● ● ● ● ● ● ● ● ●",
          "correctAnswer": 46
        },
        {
          "type": "count",
          "question": "● ● ● ● ● ● ● ● ● ● ● ● ● ● ● ● ● ● ● ● ● ● ● ● ● ● ● ● ● ● ● ● ● ● ● ● ● ● ● ● ● ● ● ● ● ● ●",
          "correctAnswer": 47
        },
        {
          "type": "count",
          "question": "● ● ● ● ● ● ● ● ● ● ● ● ● ● ● ● ● ● ● ● ● ● ● ● ● ● ● ● ● ● ● ● ● ● ● ● ● ● ● ● ● ● ● ● ● ● ● ●",
          "correctAnswer": 48
        },
        {
          "type": "count",
          "question": "● ● ● ● ● ● ● ● ● ● ● ● ● ● ● ● ● ● ● ● ● ● ● ● ● ● ● ● ● ● ● ● ● ● ● ● ● ● ● ● ● ● ● ● ● ● ● ● ●",
          "correctAnswer": 49
        },
        {
          "type": "count",
          "question": "● ● ● ● ● ● ● ● ● ● ● ● ● ● ● ● ● ● ● ● ● ● ● ● ● ● ● ● ● ● ● ● ● ● ● ● ● ● ● ● ● ● ● ● ● ● ● ● ● ●",
          "correctAnswer": 50
        }
      ]
    }
  ],
  "target": 50
}
